{
  "citation": {
    "provision": null,
    "url": "https://www.gov.uk/api/organisations"
  },
  "end_date": null,
  "from_body_id": "uk-state-body-department-for-energy-security-and-net-zero",
  "legal_status": "current",
  "record_status": "extracted",
  "relationship_id": "rel-department-for-energy-security-and-net-zero-sponsors-low-carbon-contracts-company",
  "relationship_type": "sponsors",
  "source_id": "source-official-dataset-govuk-organisations-api",
  "start_date": null,
  "to_body_id": "uk-state-body-low-carbon-contracts-company"
}
