{
  "citation": {
    "provision": null,
    "url": "https://www.gov.uk/api/organisations"
  },
  "end_date": null,
  "from_body_id": "uk-state-body-home-office",
  "legal_status": "current",
  "record_status": "extracted",
  "relationship_id": "rel-home-office-sponsors-independent-family-returns-panel",
  "relationship_type": "sponsors",
  "source_id": "source-official-dataset-govuk-organisations-api",
  "start_date": null,
  "to_body_id": "uk-state-body-independent-family-returns-panel"
}
