{
  "citation": {
    "provision": null,
    "url": "https://www.gov.uk/api/organisations"
  },
  "end_date": null,
  "from_body_id": "uk-state-body-department-for-business-and-trade",
  "legal_status": "current",
  "record_status": "extracted",
  "relationship_id": "rel-department-for-business-and-trade-sponsors-low-pay-commission",
  "relationship_type": "sponsors",
  "source_id": "source-official-dataset-govuk-organisations-api",
  "start_date": null,
  "to_body_id": "uk-state-body-low-pay-commission"
}
