{
  "citation": {
    "provision": null,
    "url": "https://www.gov.uk/api/organisations"
  },
  "end_date": null,
  "from_body_id": "uk-state-body-department-for-environment-food-rural-affairs",
  "legal_status": "current",
  "record_status": "extracted",
  "relationship_id": "rel-department-for-environment-food-rural-affairs-sponsors-british-wool",
  "relationship_type": "sponsors",
  "source_id": "source-official-dataset-govuk-organisations-api",
  "start_date": null,
  "to_body_id": "uk-state-body-british-wool"
}
