{
  "citation": {
    "provision": null,
    "url": "https://www.gov.uk/api/organisations"
  },
  "end_date": null,
  "from_body_id": "uk-state-body-cabinet-office",
  "legal_status": "current",
  "record_status": "extracted",
  "relationship_id": "rel-cabinet-office-sponsors-corporate-officers-of-the-house-of-commons",
  "relationship_type": "sponsors",
  "source_id": "source-official-dataset-govuk-organisations-api",
  "start_date": null,
  "to_body_id": "uk-state-body-corporate-officers-of-the-house-of-commons"
}
