{
  "citation": {
    "provision": null,
    "url": "https://www.gov.uk/api/organisations"
  },
  "end_date": null,
  "from_body_id": "uk-state-body-department-of-health-and-social-care",
  "legal_status": "current",
  "record_status": "extracted",
  "relationship_id": "rel-department-of-health-and-social-care-sponsors-administration-of-radioactive-substances-advisory-committee",
  "relationship_type": "sponsors",
  "source_id": "source-official-dataset-govuk-organisations-api",
  "start_date": null,
  "to_body_id": "uk-state-body-administration-of-radioactive-substances-advisory-committee"
}
