{
  "citation": {
    "provision": null,
    "url": "https://www.gov.uk/api/organisations"
  },
  "end_date": null,
  "from_body_id": "uk-state-body-science-advisory-committees",
  "legal_status": "current",
  "record_status": "extracted",
  "relationship_id": "rel-science-advisory-committees-sponsors-advisory-committee-on-the-microbiological-safety-of-food",
  "relationship_type": "sponsors",
  "source_id": "source-official-dataset-govuk-organisations-api",
  "start_date": null,
  "to_body_id": "uk-state-body-advisory-committee-on-the-microbiological-safety-of-food"
}
