{
  "citation": {
    "provision": null,
    "url": "https://www.gov.uk/api/organisations"
  },
  "end_date": null,
  "from_body_id": "uk-state-body-hm-courts-and-tribunals-service",
  "legal_status": "current",
  "record_status": "extracted",
  "relationship_id": "rel-hm-courts-and-tribunals-service-sponsors-first-tier-tribunal-tax",
  "relationship_type": "sponsors",
  "source_id": "source-official-dataset-govuk-organisations-api",
  "start_date": null,
  "to_body_id": "uk-state-body-first-tier-tribunal-tax"
}
