{
  "citation": {
    "provision": null,
    "url": "https://www.gov.uk/api/organisations"
  },
  "end_date": null,
  "from_body_id": "uk-state-body-department-for-culture-media-and-sport",
  "legal_status": "current",
  "record_status": "extracted",
  "relationship_id": "rel-department-for-culture-media-and-sport-sponsors-historic-royal-palaces",
  "relationship_type": "sponsors",
  "source_id": "source-official-dataset-govuk-organisations-api",
  "start_date": null,
  "to_body_id": "uk-state-body-historic-royal-palaces"
}
